{"candidateFingerprint":"add88a08e9d9e1f819901d3154c1043a83b5224000bd5a3c2dbc02a58a6a27c3","candidateId":"FIFTH_SPACE_CENSUS_v0","companionChecks":{"governsOutDegree":{"byOffice":{"Jupiter":{"A0":6,"A1":4,"A2":6,"D1":2,"D2":4,"D3":2,"D4":4,"D5":4,"D6":2,"D7":0},"Mars":{"A0":6,"A1":4,"A2":6,"D1":2,"D2":4,"D3":2,"D4":4,"D5":4,"D6":2,"D7":0},"Mercury":{"A0":6,"A1":4,"A2":6,"D1":2,"D2":4,"D3":2,"D4":4,"D5":4,"D6":2,"D7":0},"Moon":{"A0":6,"A1":4,"A2":6,"D1":2,"D2":4,"D3":2,"D4":4,"D5":4,"D6":2,"D7":0},"Saturn":{"A0":6,"A1":4,"A2":6,"D1":2,"D2":4,"D3":2,"D4":4,"D5":4,"D6":2,"D7":0},"Sun":{"A0":6,"A1":4,"A2":6,"D1":2,"D2":4,"D3":2,"D4":4,"D5":4,"D6":2,"D7":0},"Venus":{"A0":6,"A1":4,"A2":6,"D1":2,"D2":4,"D3":2,"D4":4,"D5":4,"D6":2,"D7":0}},"edgeCount":238,"expected":{"Jupiter":{"A0":6,"A1":4,"A2":6,"D1":2,"D2":4,"D3":2,"D4":4,"D5":4,"D6":2,"D7":0},"Mars":{"A0":6,"A1":4,"A2":6,"D1":2,"D2":4,"D3":2,"D4":4,"D5":4,"D6":2,"D7":0},"Mercury":{"A0":6,"A1":4,"A2":6,"D1":2,"D2":4,"D3":2,"D4":4,"D5":4,"D6":2,"D7":0},"Moon":{"A0":6,"A1":4,"A2":6,"D1":2,"D2":4,"D3":2,"D4":4,"D5":4,"D6":2,"D7":0},"Saturn":{"A0":6,"A1":4,"A2":6,"D1":2,"D2":4,"D3":2,"D4":4,"D5":4,"D6":2,"D7":0},"Sun":{"A0":6,"A1":4,"A2":6,"D1":2,"D2":4,"D3":2,"D4":4,"D5":4,"D6":2,"D7":0},"Venus":{"A0":6,"A1":4,"A2":6,"D1":2,"D2":4,"D3":2,"D4":4,"D5":4,"D6":2,"D7":0}},"perOfficeTotal":{"Jupiter":34,"Mars":34,"Mercury":34,"Moon":34,"Saturn":34,"Sun":34,"Venus":34},"verified":true},"obs013Addendum":{"a2AnchorsAtCeiling":true,"ceilingRespected":true,"ceilingStateCount":21,"ceilingStates":[{"forte":"7-1","gapMultiset":[1,1,2,2,2,2,2],"name":"7-1 terminal cluster state 127","office":"Jupiter","role":"anchor","stateId":127,"tier":"D7"},{"forte":"7-8","gapMultiset":[1,1,2,2,2,2,2],"name":"Alt ♮25♭67","office":"Jupiter","role":"anchor","stateId":381,"tier":"D6"},{"forte":"7-8","gapMultiset":[1,1,2,2,2,2,2],"name":"Infra-Alt 56♭7","office":"Saturn","role":"anchor","stateId":1119,"tier":"D6"},{"forte":"7-33","gapMultiset":[1,1,2,2,2,2,2],"name":"Leading Whole-Tone Inverse","office":"Moon","role":"anchor","stateId":1367,"tier":"A2"},{"forte":"7-33","gapMultiset":[1,1,2,2,2,2,2],"name":"Storian","office":"Saturn","role":"anchor","stateId":1373,"tier":"A2"},{"forte":"7-33","gapMultiset":[1,1,2,2,2,2,2],"name":"Major Locrian","office":"Jupiter","role":"anchor","stateId":1397,"tier":"A2"},{"forte":"7-33","gapMultiset":[1,1,2,2,2,2,2],"name":"Lydian Minor","office":"Mars","role":"anchor","stateId":1493,"tier":"A2"},{"forte":"7-33","gapMultiset":[1,1,2,2,2,2,2],"name":"Aeroptian","office":"Sun","role":"anchor","stateId":1877,"tier":"A2"},{"forte":"7-8","gapMultiset":[1,1,2,2,2,2,2],"name":"Dominant +234","office":"Mars","role":"anchor","stateId":2001,"tier":"D6"},{"forte":"7-1","gapMultiset":[1,1,2,2,2,2,2],"name":"7-1 terminal cluster state 2111","office":"Saturn","role":"anchor","stateId":2111,"tier":"D7"},{"forte":"7-8","gapMultiset":[1,1,2,2,2,2,2],"name":"Alt ♮67345","office":"Moon","role":"anchor","stateId":2607,"tier":"D6"},{"forte":"7-33","gapMultiset":[1,1,2,2,2,2,2],"name":"Neapolitan Major","office":"Mercury","role":"anchor","stateId":2731,"tier":"A2"},{"forte":"7-1","gapMultiset":[1,1,2,2,2,2,2],"name":"7-1 terminal cluster state 3103","office":"Moon","role":"anchor","stateId":3103,"tier":"D7"},{"forte":"7-8","gapMultiset":[1,1,2,2,2,2,2],"name":"Crater Scale","office":"Mercury","role":"anchor","stateId":3351,"tier":"D6"},{"forte":"7-33","gapMultiset":[1,1,2,2,2,2,2],"name":"Leading Whole-Tone","office":"Venus","role":"anchor","stateId":3413,"tier":"A2"},{"forte":"7-1","gapMultiset":[1,1,2,2,2,2,2],"name":"7-1 terminal cluster state 3599","office":"Mercury","role":"anchor","stateId":3599,"tier":"D7"},{"forte":"7-8","gapMultiset":[1,1,2,2,2,2,2],"name":"Phrygian +45","office":"Venus","role":"anchor","stateId":3723,"tier":"D6"},{"forte":"7-1","gapMultiset":[1,1,2,2,2,2,2],"name":"7-1 terminal cluster state 3847","office":"Venus","role":"anchor","stateId":3847,"tier":"D7"},{"forte":"7-8","gapMultiset":[1,1,2,2,2,2,2],"name":"Superlydian Augmented ♮235♯4","office":"Sun","role":"anchor","stateId":3909,"tier":"D6"},{"forte":"7-1","gapMultiset":[1,1,2,2,2,2,2],"name":"7-1 terminal cluster state 3971","office":"Sun","role":"anchor","stateId":3971,"tier":"D7"},{"forte":"7-1","gapMultiset":[1,1,2,2,2,2,2],"name":"7-1 terminal cluster state 4033","office":"Mars","role":"anchor","stateId":4033,"tier":"D7"}],"d7AnchorsAtCeiling":true,"spanCeiling":10,"theorem":"seven points on the 12-cycle have seven gaps summing to 12, so the largest gap is at least 2 and the minimal covering arc span is at most 10: the A-ladder ceiling is geometry, not fiat","verified":true},"satelliteFamilyUniformity":{"familyCount":17,"perFamilyUniform":true,"satellitesPerFamily":14,"satellitesPerOffice":{"Jupiter":34,"Mars":34,"Mercury":34,"Moon":34,"Saturn":34,"Sun":34,"Venus":34},"statesPerOfficePerFamily":2,"verified":true}},"courtBinding":{"expectedSpan":4,"mask":661,"positionId":"C0","source":"seven-governors-court-substrate-v0.1.0/canonical/court-rooted-positions.json"},"evidenceBindings":{"canonicalLedgerSha256":"e6570972260fdae5c4ca878272dc89a9ff353d48762eefbe019707d229cd242d","courtRootedPositionsSha256":"85100e4bb5185b2630d1607a35e417fc90fdd5bb4ae63f0e775224d6b1436fec","decisionLedgerSha256":"8901b4a33fadf1f8d20f1bb9f57016f8f75a880ab197775545a77de1a749ad13","networkFingerprint":"21e2a632837ecf40fe9229e9eb4ec0a5cceb9e2043fe89cb8e1d320518d7bdbc","observationLedgerSha256":"8e0be9f5bcee0af1aeb87b8ee71fa18121376c1e2b8e23416439c8834e17787f"},"method":{"fifthMask":"integer 0..4095; bit i set iff fifth-position i occupied","fifthOrder":[0,7,2,9,4,11,6,1,8,3,10,5],"fifthPositions":"derived deterministically from pitchClasses via FIFTH_POS","fifthSpan":"minimal covering arc = 12 minus largest cyclic gap","holes":"span + 1 - cardinality","ordering":"records sorted by stateId ascending"},"records":[{"chirality":"achiral","fifthArc":"[2,0]","fifthMask":2773,"fifthPositions":[0,2,4,6,7,9,11],"fifthSpan":10,"fineRole":"terminal_anchor_D7","forte":"7-1","gapMultiset":[1,1,2,2,2,2,2],"holes":4,"name":"7-1 terminal cluster state 127","office":"Jupiter","officeIndex":4,"pitchClasses":[0,1,2,3,4,5,6],"pitchMask":127,"provenancePath":"canonical/universal-heptatonic-ledger.json","role":"anchor","stateId":127,"tier":"D7"},{"chirality":"chiral","fifthArc":"[7,4]","fifthMask":2711,"fifthPositions":[0,1,2,4,7,9,11],"fifthSpan":9,"fineRole":"satellite_D6","forte":"7-2","gapMultiset":[1,1,1,2,2,2,3],"holes":3,"name":"Ultra-Alt 67","office":"Jupiter","officeIndex":4,"pitchClasses":[0,1,2,3,4,5,7],"pitchMask":191,"provenancePath":"canonical/universal-heptatonic-ledger.json","role":"satellite","stateId":191,"tier":"D6"},{"chirality":"chiral","fifthArc":"[0,9]","fifthMask":727,"fifthPositions":[0,1,2,4,6,7,9],"fifthSpan":9,"fineRole":"oriented_convergence","forte":"7-4","gapMultiset":[1,1,1,2,2,2,3],"holes":3,"name":"Scale 223","office":null,"officeIndex":null,"pitchClasses":[0,1,2,3,4,6,7],"pitchMask":223,"provenancePath":"canonical/universal-heptatonic-ledger.json","role":"boundary","stateId":223,"tier":null},{"chirality":"chiral","fifthArc":"[6,2]","fifthMask":2759,"fifthPositions":[0,1,2,6,7,9,11],"fifthSpan":8,"fineRole":"peripheral_leaf","forte":"7-5","gapMultiset":[1,1,1,1,2,2,4],"holes":2,"name":"Infra-Alt 6𝄫𝄫7","office":null,"officeIndex":null,"pitchClasses":[0,1,2,3,5,6,7],"pitchMask":239,"provenancePath":"canonical/universal-heptatonic-ledger.json","role":"boundary","stateId":239,"tier":null},{"chirality":"chiral","fifthArc":"[11,7]","fifthMask":2263,"fifthPositions":[0,1,2,4,6,7,11],"fifthSpan":8,"fineRole":"peripheral_leaf","forte":"7-5","gapMultiset":[1,1,1,1,2,2,4],"holes":2,"name":"Scale 247","office":null,"officeIndex":null,"pitchClasses":[0,1,2,4,5,6,7],"pitchMask":247,"provenancePath":"canonical/universal-heptatonic-ledger.json","role":"boundary","stateId":247,"tier":null},{"chirality":"chiral","fifthArc":"[4,1]","fifthMask":2771,"fifthPositions":[0,1,4,6,7,9,11],"fifthSpan":9,"fineRole":"oriented_convergence","forte":"7-4","gapMultiset":[1,1,1,2,2,2,3],"holes":3,"name":"Scale 251","office":null,"officeIndex":null,"pitchClasses":[0,1,3,4,5,6,7],"pitchMask":251,"provenancePath":"canonical/universal-heptatonic-ledger.json","role":"boundary","stateId":251,"tier":null},{"chirality":"chiral","fifthArc":"[9,6]","fifthMask":2647,"fifthPositions":[0,1,2,4,6,9,11],"fifthSpan":9,"fineRole":"satellite_D6","forte":"7-2","gapMultiset":[1,1,1,2,2,2,3],"holes":3,"name":"Alt ♮25♭67","office":"Jupiter","officeIndex":4,"pitchClasses":[0,2,3,4,5,6,7],"pitchMask":253,"provenancePath":"canonical/universal-heptatonic-ledger.json","role":"satellite","stateId":253,"tier":"D6"},{"chirality":"chiral","fifthArc":"[7,4]","fifthMask":2965,"fifthPositions":[0,2,4,7,8,9,11],"fifthSpan":9,"fineRole":"oriented_convergence","forte":"7-3","gapMultiset":[1,1,1,2,2,2,3],"holes":3,"name":"7-3 rooted state 319","office":null,"officeIndex":null,"pitchClasses":[0,1,2,3,4,5,8],"pitchMask":319,"provenancePath":"canonical/universal-heptatonic-ledger.json","role":"boundary","stateId":319,"tier":null},{"chirality":"chiral","fifthArc":"[0,9]","fifthMask":981,"fifthPositions":[0,2,4,6,7,8,9],"fifthSpan":9,"fineRole":"oriented_convergence","forte":"7-9","gapMultiset":[1,1,1,2,2,2,3],"holes":3,"name":"Infra-Alt 567","office":null,"officeIndex":null,"pitchClasses":[0,1,2,3,4,6,8],"pitchMask":351,"provenancePath":"canonical/universal-heptatonic-ledger.json","role":"boundary","stateId":351,"tier":null},{"chirality":"chiral","fifthArc":"[6,2]","fifthMask":3013,"fifthPositions":[0,2,6,7,8,9,11],"fifthSpan":8,"fineRole":"oriented_convergence","forte":"7-Z36","gapMultiset":[1,1,1,1,2,2,4],"holes":2,"name":"Infra-Alt 67","office":null,"officeIndex":null,"pitchClasses":[0,1,2,3,5,6,8],"pitchMask":367,"provenancePath":"canonical/universal-heptatonic-ledger.json","role":"boundary","stateId":367,"tier":null},{"chirality":"chiral","fifthArc":"[11,8]","fifthMask":2517,"fifthPosi